{
  "schemaVersion": 5,
  "eventId": "alpaca-trading-agents-2026",
  "state": "BUILDING",
  "planSha256": "23168c99a2a14f7bc2ca5e0e097ad3235d85149cceaa0d7dabe957e964867dbd",
  "artifactRequirements": [
    {
      "id": "submission-repository",
      "kind": "repository",
      "source": "event_rules",
      "description": "MIT-licensed project repository containing the autonomous options trading agent and submission documentation."
    },
    {
      "id": "submission-writeup",
      "kind": "document",
      "source": "event_rules",
      "description": "One-page write-up covering AI decision logic, risk gates, and Alpaca infrastructure (MCP/CLI, paper account workflow)."
    },
    {
      "id": "alpaca-paper-account-id",
      "kind": "document",
      "source": "event_rules",
      "description": "Dedicated $100k Alpaca paper account ID already created for this hackathon, recorded as ID-only in docs/ALPACA_ACCOUNT.md. Never store API keys in the repository."
    },
    {
      "id": "alpaca-mcp-cli-integration",
      "kind": "integration",
      "source": "event_rules",
      "description": "Working Alpaca MCP Server or official Alpaca CLI execution path that places real paper option orders, verified by scripts/verify-paper-mcp-order.py."
    },
    {
      "id": "options-trading-strategy",
      "kind": "integration",
      "source": "event_rules",
      "description": "Autonomous agent strategy that includes options trades (wheel and/or vertical spreads) on Alpaca paper, not stock-only execution."
    },
    {
      "id": "remotion-demo-video",
      "kind": "video",
      "source": "approved_plan",
      "description": "Formal Remotion-produced demo video of the autonomous options agent (decision, risk gate, MCP/CLI paper order). Source in remotion/, rendered MP4 at artifacts/demo.mp4, plus shot list. Screen recordings or empty scripts do not satisfy this requirement."
    },
    {
      "id": "third-party-notices",
      "kind": "document",
      "source": "approved_plan",
      "description": "THIRD_PARTY_NOTICES.md and README attribution for the pinned MIT snapshot and Alpaca SDK/MCP/CLI dependencies."
    }
  ],
  "buildId": null,
  "planApproval": {
    "command": "APPROVE PLAN alpaca-trading-agents-2026 23168c99a2a14f7bc2ca5e0e097ad3235d85149cceaa0d7dabe957e964867dbd",
    "eventId": "alpaca-trading-agents-2026",
    "planSha256": "23168c99a2a14f7bc2ca5e0e097ad3235d85149cceaa0d7dabe957e964867dbd",
    "approvedAt": "2026-08-29T00:53:23Z"
  },
  "builderRun": {
    "idempotencyKey": "builder-v3:alpaca-trading-agents-2026:23168c99a2a14f7bc2ca5e0e097ad3235d85149cceaa0d7dabe957e964867dbd",
    "attempt": 1,
    "status": "running",
    "startedAt": "2026-08-29T00:53:23Z",
    "finishedAt": null
  },
  "qualityGates": {
    "mvp": {
      "status": "pending",
      "checkedAt": null,
      "evidence": []
    },
    "submissionReady": {
      "status": "pending",
      "checkedAt": null,
      "evidence": [],
      "reviewRounds": 0,
      "review": null
    }
  },
  "updatedAt": "2026-08-29T01:32:17Z"
}
